Story,id,text_original,Sentiments-GPT5,Multi-GPT5,Sentiments-Perplexity,Multi-Perplexity,Sentiments-Mistral,Multi-Mistral,Sentiments-GPTOSS20B,Multi-GPTOSS20B
6-Dornroeschen,S20,So spricht die 13. Fee ihren bösen Wunsch. Und verschwindet.,negative,no,negative,no,negative,no,negative,no
6-Dornroeschen,S21,Die Gäste sind erschrocken. Und alle Menschen auf dem Fest haben Angst.,negative,no,negative,no,negative,no,negative,no
6-Dornroeschen,S22,Aber zum Glück hat die 12. Fee ihren Wunsch noch nicht gesprochen:,positive,no,positive,no,neutral-positive,yes,positive,no
6-Dornroeschen,S23,Die 12. Fee kann den bösen Wunsch nicht rückgängig machen. Aber die 12. Fee kann den bösen Wunsch verwandeln.,neutral,no,neutral,no,neutral-positive,yes,positive,no
6-Dornroeschen,S24,So sagt die 12. Fee: Dornröschen wird an ihrem 15. Geburtstag nicht sterben.,positive,no,positive,no,positive,no,positive,no
6-Dornroeschen,S25,Aber Dornröschen wird 100 Jahre schlafen. Jetzt hat auch der König Angst.,negative,no,negative,no,neutral-negative,yes,neutral-negative,yes
6-Dornroeschen,S26,Und sagt: Alle Spindeln im Königreich werden verbrannt.,neutral,no,neutral,no,neutral,no,negative,no
6-Dornroeschen,S27,So kann sich Dornröschen nicht an einer Spindel stechen. Und Dornröschen muss nicht 100 Jahre schlafen.,positive,no,positive,no,positive,no,positive,no
6-Dornroeschen,S28,Die Jahre vergehen. Und Dornröschen wird älter.,neutral,no,neutral,no,neutral,no,neutral,no
6-Dornroeschen,S29,Alle guten Wünsche von den 12 Feen gehen in Erfüllung:,positive,no,positive,no,positive,no,positive,no
6-Dornroeschen,S30,Dornröschen ist sehr schön. Und Dornröschen ist sehr freundlich. Und alle mögen Dornröschen.,positive,no,positive,no,positive,no,positive,no
6-Dornroeschen,S31,Es ist der 15. Geburtstag von Dornröschen: Dornröschen ist allein. Und Dornröschen erkundet das Schloss.,neutral,no,neutral,no,neutral,no,neutral,no
6-Dornroeschen,S32,Dornröschen kommt zu einem alten Turm. Im Turm ist ein kleines Zimmer. Dornröschen geht in das kleine Zimmer:,neutral,no,neutral,no,neutral,no,neutral,no
6-Dornroeschen,S33,Eine alte Frau sitzt an einem Spinnrad. Die alte Frau arbeitet mit einer Spindel.,neutral,no,neutral,no,neutral,no,neutral,no
6-Dornroeschen,S34,Dornröschen fragt die alte Frau: Was machst du da?,neutral,no,neutral,no,neutral,no,neutral,no
6-Dornroeschen,S35,Die alte Frau antwortet: Ich mache Wolle zu einem Faden.,neutral,no,neutral,no,neutral,no,neutral,no
6-Dornroeschen,S36,Dornröschen ist neugierig. Dornröschen hat noch nie eine Spindel gesehen. Dornröschen nimmt die Spindel in die Hand.,neutral,no,neutral,no,neutral,no,neutral,no
6-Dornroeschen,S37,Plötzlich geht der böse Wunsch von der 13. Fee in Erfüllung: Dornröschen sticht sich an der Spindel.,negative,no,negative,no,negative,no,negative,no
6-Dornroeschen,S38,Und Dornröschen fällt in einen tiefen Schlaf. Aber nicht nur Dorn·röschen schläft ein.,negative,no,negative,no,negative,no,neutral,no
6-Dornroeschen,S39,Auch die Menschen im Schloss schlafen ein: Der König und die Königin. Der Koch. Die Diener.,negative,no,negative,no,negative,no,neutral,no
6-Dornroeschen,S40,Und sogar die Tiere schlafen ein: Die Pferde im Stall. Die Tauben auf dem Dach. Und die Fliegen an der Wand.,negative,no,neutral,no,negative,no,neutral,no
6-Dornroeschen,S41,Jetzt ist es überall still. Die Jahre vergehen.,neutral,no,neutral,no,neutral,no,neutral,no
6-Dornroeschen,S42,Und eine Dornenhecke wächst um das Schloss. Die Dornenhecke wird jedes Jahr größer. Bis das ganze Schloss von der Dornenhecke bedeckt ist.,neutral,no,neutral,no,negative,no,neutral,no
6-Dornroeschen,S43,Die Menschen im Land erzählen sich die Geschichte von Dornröschen.,neutral,no,neutral,no,neutral,no,neutral,no
6-Dornroeschen,S44,Und viele Prinzen wollen in das Schloss. Die Prinzen wollen Dornröschen wecken.,positive,no,positive,no,positive,no,neutral,no
6-Dornroeschen,S45,Aber die Dornenhecke bedeckt das ganze Schloss. Und die Dornen sind sehr gefährlich.,negative,no,negative,no,negative,no,negative,no
6-Dornroeschen,S46,Viele Prinzen stechen sich an den Dornen. Und viele Prinzen sterben.,negative,no,negative,no,negative,no,negative,no
6-Dornroeschen,S47,Dornröschen schläft jetzt schon 100 Jahre. Aber kein Prinz konnte Dornröschen wecken.,negative,no,negative,no,neutral,no,negative,no
6-Dornroeschen,S48,Da kommt ein besonderer Prinz in das Land. Der Prinz hört die Geschichte von Dornröschen.,neutral,no,neutral,no,neutral,no,neutral,no
6-Dornroeschen,S49,Der Prinz denkt: Viele Prinzen wollten Dornröschen wecken. Und viele Prinzen sind in der Dornenhecke gestorben.,negative,no,neutral,no,neutral,no,negative,no
6-Dornroeschen,S50,Aber ich habe keine Angst. Ich werde Dornröschen wecken.,positive,no,positive,no,positive,no,positive,no
6-Dornroeschen,S51,Und so reitet der Prinz zum Schloss von Dornröschen. Der Prinz kommt zu dem Schloss von Dornröschen. Und der Prinz sieht die Dornenhecke.,neutral,no,neutral,no,neutral,no,neutral,no
6-Dornroeschen,S52,Der Prinz entdeckt einen geheimen Weg. Dieser Weg führt durch die Dornenhecke.,neutral,no,neutral,no,positive,no,neutral,no
6-Dornroeschen,S53,Der Prinz geht den Weg entlang. Und der Prinz sticht sich nicht an den Dornen.,positive,no,positive,no,positive,no,neutral,no
6-Dornroeschen,S54,So kommt der Prinz bis ins Schloss. Im Schloss ist es ganz still. Alle schlafen nämlich.,neutral,no,neutral,no,neutral,no,neutral,no
6-Dornroeschen,S55,Der Prinz geht durch das Schloss. Und der Prinz findet den alten Turm.,neutral,no,neutral,no,neutral,no,neutral,no
6-Dornroeschen,S56,Im Turm liegt Dornröschen auf einem Bett. Und schläft.,neutral,no,neutral,no,neutral,no,neutral,no
6-Dornroeschen,S57,Der Prinz sieht Dornröschen. Und der Prinz denkt: Dornröschen ist sehr schön.,positive,no,positive,no,positive,no,positive,no
6-Dornroeschen,S58,Der Prinz bückt sich zu Dornröschen herunter. Und der Prinz küsst Dornröschen.,positive,no,positive,no,positive,no,positive,no
6-Dornroeschen,S59,Plötzlich öffnet Dornröschen die Augen. Und Dornröschen lächelt den Prinzen an.,positive,no,positive,no,positive,no,positive,no
6-Dornroeschen,S60,Jetzt erwachen auch die Menschen im Schloss: Der König und die Königin. Der Koch. Die Diener.,positive,no,positive,no,positive,no,positive,no
6-Dornroeschen,S61,Und auch die Tiere erwachen: Die Pferde im Stall. Die Tauben auf dem Dach. Und die Fliegen an der Wand.,positive,no,positive,no,positive,no,positive,no
6-Dornroeschen,S62,Das Schloss ist wieder voller Leben.,positive,no,positive,no,positive,no,positive,no
6-Dornroeschen,S63,Dornröschen und der Prinz heiraten. Und alle Menschen im Land feiern ein großes Fest.,positive,no,positive,no,positive,no,positive,no
6-Dornroeschen,S64,Und Dornröschen und der Prinz leben für immer glücklich zusammen. Das war das Märchen von Dornröschen.,positive,no,positive,no,positive,no,positive,no
7-BremerStadtmusikanten,S1,Die Bremer Stadtmusikanten. Es war einmal: So fangen Märchen an. Ein Märchen ist eine sehr alte Geschichte.,neutral,no,neutral,no,neutral,no,neutral,no
7-BremerStadtmusikanten,S2,Dieses Märchen heißt: Die Bremer Stadtmusikanten. Das Märchen geht so:,neutral,no,neutral,no,neutral,no,neutral,no
7-BremerStadtmusikanten,S3,Ein Mann hat eine Mühle. Der Mann hat auch einen Esel.,neutral,no,neutral,no,neutral,no,neutral,no
7-BremerStadtmusikanten,S4,Der Esel trägt viele Jahre lang Getreidesäcke zur Mühle.,neutral,no,neutral,no,neutral,no,neutral,no
7-BremerStadtmusikanten,S5,Mit den Jahren wird der Esel alt. Und schwach.,negative,no,negative,no,negative,no,neutral,no
7-BremerStadtmusikanten,S6,Aber der Mann möchte keinen alten und schwachen Esel. Deshalb will der Mann den Esel töten.,negative,no,negative,no,negative,no,negative,no
7-BremerStadtmusikanten,S7,Das merkt der Esel. Deshalb will der Esel fortlaufen.,negative,no,negative,no,negative,no,neutral,no
7-BremerStadtmusikanten,S8,Der Esel will nach Bremen gehen. Bremen ist eine Stadt in Norddeutschland.,neutral,no,neutral,no,neutral,no,neutral,no
7-BremerStadtmusikanten,S9,In Bremen will der Esel ein Stadtmusikant werden. Musikant ist ein anderes Wort für Musiker.,positive,no,positive,no,positive,no,neutral,no
7-BremerStadtmusikanten,S10,Der Esel will also in Bremen Musik machen.,positive,no,positive,no,positive,no,neutral,no
7-BremerStadtmusikanten,S11,So läuft der Esel fort. Nach einer Weile trifft der Esel einen Hund.,neutral,no,neutral,no,neutral,no,neutral,no
7-BremerStadtmusikanten,S12,Der Hund sieht sehr traurig aus. Der Esel fragt den Hund: Warum bist du so traurig?,negative,no,negative,no,negative,no,negative,no
7-BremerStadtmusikanten,S13,Der Hund antwortet: Ich bin alt. Und ich bin schwach.,negative,no,negative,no,negative,no,negative,no
7-BremerStadtmusikanten,S14,Ich kann meinem Herrn nicht mehr beim Jagen helfen. Mein Herr wollte mich töten. Deshalb bin ich fortgelaufen.,negative,no,negative,no,negative,no,negative,no
7-BremerStadtmusikanten,S15,Der Esel sagt zum Hund. Ich gehe nach Bremen. In Bremen werde ich Stadtmusikant. Willst du mitkommen?,positive,no,positive,no,positive,no,neutral,no
7-BremerStadtmusikanten,S16,Der Hund kommt gerne mit. Und so gehen der Esel und der Hund zusammen nach Bremen.,positive,no,positive,no,positive,no,positive,no
7-BremerStadtmusikanten,S17,Auf ihrem Weg treffen der Esel und der Hund eine Katze. Die Katze sieht sehr traurig aus.,negative,no,negative,no,negative,no,negative,no
7-BremerStadtmusikanten,S18,Der Esel fragt die Katze: Warum bist du so traurig?,negative,no,negative,no,negative,no,negative,no
7-BremerStadtmusikanten,S19,Die Katze sagt: Ich bin alt. Und ich bin schwach.,negative,no,negative,no,negative,no,negative,no
7-BremerStadtmusikanten,S20,Ich kann keine Mäuse mehr jagen. Deshalb will mein Herr mich töten.,negative,no,negative,no,negative,no,negative,no
7-BremerStadtmusikanten,S21,Der Esel sagt zur Katze: Wir gehen nach Bremen. In Bremen werden wir Stadtmusikanten. Willst du mitkommen?,positive,no,positive,no,positive,no,neutral,no
7-BremerStadtmusikanten,S22,Die Katze kommt gerne mit. Und so gehen der Esel und der Hund und die Katze zusammen nach Bremen.,positive,no,positive,no,positive,no,positive,no
7-BremerStadtmusikanten,S23,Auf ihrem Weg kommen die Tiere zu einem Bauernhof. Auf dem Bauernhof treffen die Tiere einen Hahn.,neutral,no,neutral,no,neutral,no,neutral,no
7-BremerStadtmusikanten,S24,Der Hahn schreit sehr laut. Der Esel fragt den Hahn: Warum schreist du so laut?,neutral,no,neutral,no,negative,no,neutral,no
7-BremerStadtmusikanten,S25,Der Hahn antwortet: Morgen ist ein großes Fest. Dann will mich meine Herrin braten. Und essen.,negative,no,negative,no,negative,no,negative,no
7-BremerStadtmusikanten,S26,Aber ich will nicht sterben. Deshalb schreie ich so laut.,negative,no,negative,no,negative,no,negative,no
7-BremerStadtmusikanten,S27,Der Esel sagt zum Hahn. Wir gehen nach Bremen. In Bremen werden wir Stadtmusikanten. Willst du mitkommen?,positive,no,positive,no,positive,no,neutral,no
7-BremerStadtmusikanten,S28,Und auch der Hahn kommt gerne mit. Zusammen gehen die 4 Tiere nach Bremen: Der Esel. Der Hund. Die Katze. Und der Hahn.,positive,no,positive,no,positive,no,positive,no
7-BremerStadtmusikanten,S29,Aber der Weg nach Bremen ist sehr weit: Die Tiere gehen den ganzen Tag.,neutral,no,neutral,no,neutral,no,neutral,no
7-BremerStadtmusikanten,S30,Langsam wird es dunkel. Die Tiere kommen in einen Wald.,neutral,no,neutral,no,neutral,no,neutral,no
7-BremerStadtmusikanten,S31,Die Tiere sind sehr müde. Die Tiere wollen im Wald schlafen.,neutral,no,neutral,no,neutral,no,neutral,no
7-BremerStadtmusikanten,S32,Die Tiere suchen einen Platz zum Schlafen:,neutral,no,neutral,no,neutral,no,neutral,no
7-BremerStadtmusikanten,S33,Der Esel und der Hund legen sich unter einen großen Baum. Die Katze klettert auf den Baum. Und legt sich auf einen Ast. Der Hahn fliegt bis auf die Spitze vom Baum.,neutral,no,neutral,no,neutral,no,neutral,no
7-BremerStadtmusikanten,S34,Dann schaut sich der Hahn um: In der Nähe sieht der Hahn ein helles Licht brennen.,neutral,no,neutral,no,neutral,no,neutral,no
7-BremerStadtmusikanten,S35,Der Hahn denkt: Das Licht kommt von einem Haus.,neutral,no,neutral,no,neutral,no,neutral,no
7-BremerStadtmusikanten,S36,Der Hahn sagt zu den anderen Tieren: Ich kann ein Haus sehen. Lasst uns zu dem Haus gehen.,neutral,no,neutral,no,neutral,no,neutral,no
7-BremerStadtmusikanten,S37,Die Tiere finden die Idee vom Hahn gut. Die Tiere machen sich auf den Weg zum Haus.,positive,no,positive,no,neutral,no,neutral,no
7-BremerStadtmusikanten,S38,Die Tiere folgen dem Licht. Das Licht wird immer heller. Die Tiere kommen zu dem Haus.,neutral,no,neutral,no,neutral,no,neutral,no
7-BremerStadtmusikanten,S39,Und der Esel schaut durch ein Fenster in das Haus. Der Hahn fragt den Esel: Was siehst du?,neutral,no,neutral,no,neutral,no,neutral,no
7-BremerStadtmusikanten,S40,Der Esel antwortet: Ich sehe einen großen Tisch. An dem Tisch sitzen Räuber. Die Räuber essen und trinken.,negative,no,negative,no,neutral,no,neutral,no
7-BremerStadtmusikanten,S41,Der Hahn sagt zum Esel: Wir wollen auch an dem Tisch sitzen. Der Esel stimmt zu.,positive,no,positive,no,positive,no,neutral,no
7-BremerStadtmusikanten,S42,Und der Esel sagt: Wir müssen die Räuber verjagen.,neutral,no,negative,no,negative,no,neutral,no
7-BremerStadtmusikanten,S43,Dann können wir auch an dem Tisch sitzen. Und essen und trinken.,positive,no,positive,yes,positive,no,neutral,no
7-BremerStadtmusikanten,S44,Die Tiere überlegen. Dann haben die Tiere eine Idee:,neutral,no,positive,no,neutral,no,neutral,no
7-BremerStadtmusikanten,S45,Der Esel stellt sich vor das Fenster. Der Hund springt auf den Rücken vom Esel. Die Katze klettert auf den Rücken vom Hund. Und der Hahn fliegt auf den Rücken von der Katze.,neutral,no,neutral,no,neutral,no,neutral,no
7-BremerStadtmusikanten,S46,Dann machen die 4 Tiere zusammen Musik: Der Esel schreit. Der Hund bellt. Die Katze miaut. Und der Hahn kräht.,neutral,no,neutral,no,neutral,no,neutral,no
7-BremerStadtmusikanten,S47,Die Musik von den 4 Tieren ist laut. Und die Musik ist schrecklich.,negative,no,negative,no,negative,no,negative,no
7-BremerStadtmusikanten,S48,Die Räuber denken: Das ist ein Gespenst. Nur Gespenster können so einen schrecklichen Lärm machen.,negative,no,negative,no,negative,no,negative,no
7-BremerStadtmusikanten,S49,Die Räuber bekommen Angst. Und die Räuber laufen fort.,positive,no,positive,yes,negative,no,negative,no
7-BremerStadtmusikanten,S50,Jetzt ist die Tür vom Haus offen. Die 4 Tiere gehen in das Haus.,positive,no,positive,no,positive,no,neutral,no
7-BremerStadtmusikanten,S51,Und setzen sich an den Tisch. Die 4 Tiere essen und trinken. Dann sind die 4 Tiere satt.,positive,no,positive,no,positive,no,neutral,no
7-BremerStadtmusikanten,S52,Und werden müde. Die 4 Tiere suchen sich einen Schlafplatz:,neutral,no,neutral,no,neutral,no,neutral,no
7-BremerStadtmusikanten,S53,Der Esel geht vor das Haus. Vor dem Haus ist ein Misthaufen. Der Esel schläft bei dem Misthaufen.,neutral,no,neutral,no,neutral,no,neutral,no
7-BremerStadtmusikanten,S54,Der Hund schläft vor der Tür. Die Katze schläft in der Küche.,neutral,no,neutral,no,neutral,no,neutral,no
7-BremerStadtmusikanten,S55,Und der Hahn schläft auf einem Balken unter dem Dach. Das Licht ist aus. Und die 4 Tiere schlafen ein.,neutral,no,neutral,no,neutral,no,neutral,no
7-BremerStadtmusikanten,S56,Aber die Räuber sind noch in der Nähe vom Haus.,negative,no,negative,no,neutral,no,neutral,no
7-BremerStadtmusikanten,S57,Die Räuber sehen: Das Licht im Haus ist aus. Alles ist ganz still.,neutral,no,neutral,no,neutral,no,neutral,no
7-BremerStadtmusikanten,S58,Deshalb sagt der Anführer von den Räubern: Wir haben uns geirrt. Vielleicht war es doch kein Gespenst. Lasst uns zurück zum Haus gehen.,neutral,no,neutral,no,neutral,no,neutral,no
7-BremerStadtmusikanten,S59,Aber die Räuber sind vorsichtig: Es geht nur 1 Räuber in das Haus.,neutral,no,neutral,no,neutral,no,neutral,no
7-BremerStadtmusikanten,S60,Der Räuber will das Licht anmachen. So kann der Räuber besser sehen.,neutral,no,neutral,no,neutral,no,neutral,no
7-BremerStadtmusikanten,S61,Der Räuber weiß: In der Küche gibt es Kohle.,neutral,no,neutral,no,neutral,no,neutral,no
7-BremerStadtmusikanten,S62,Die Kohle glüht. Die Kohle macht ein wenig Licht. Also geht der Räuber in die Küche.,neutral,no,neutral,no,neutral,no,neutral,no
7-BremerStadtmusikanten,S63,In der Küche sieht der Räuber 2 leuchtende Punkte. Der Räuber denkt: Das ist die Kohle.,neutral,no,neutral,no,neutral,no,neutral,no
7-BremerStadtmusikanten,S64,Der Räuber will nach der Kohle greifen. Aber der Räuber weiß nicht: In der Küche liegt die Katze.,neutral,no,neutral,no,neutral,no,neutral,no
7-BremerStadtmusikanten,S65,Die Katze schaut den Räuber an. Die Augen von der Katze leuchten im Dunkeln. Die Augen von der Katze leuchten wie 2 Stücken Kohle.,neutral,no,neutral,no,neutral,no,neutral,no
7-BremerStadtmusikanten,S66,Die Katze springt den Räuber an. Und die Katze zerkratzt das Gesicht vom Räuber.,negative,no,negative,no,negative,no,negative,no
7-BremerStadtmusikanten,S67,Jetzt hat der Räuber Angst. Und der Räuber schreit. Der Räuber will schnell aus dem Haus laufen.,negative,no,negative,no,negative,no,negative,no
7-BremerStadtmusikanten,S68,Der Räuber rennt zur Tür. Aber vor der Tür liegt noch der Hund.,neutral,no,neutral,no,neutral,no,neutral,no
7-BremerStadtmusikanten,S69,Der Hund beißt den Räuber ins Bein. Der Räuber schreit noch lauter. Der Räuber rennt aus dem Haus.,negative,no,negative,no,negative,no,negative,no
7-BremerStadtmusikanten,S70,Der Räuber rennt an dem Misthaufen vorbei. Am Misthaufen wartet schon der Esel.,neutral,no,neutral,no,neutral,no,neutral,no
7-BremerStadtmusikanten,S71,Der Esel tritt den Räuber. Und der Räuber schreit. Und schreit.,negative,no,negative,no,negative,no,negative,no
7-BremerStadtmusikanten,S72,Und so wird auch der Hahn wach. Der Hahn macht Krach. Und der Räuber läuft davon.,positive,no,positive,yes,negative,no,neutral,no
7-BremerStadtmusikanten,S73,Der Räuber läuft zu den anderen Räubern.,neutral,no,neutral,no,neutral,no,neutral,no
7-BremerStadtmusikanten,S74,Der Räuber erzählt mit einer ängstlichen Stimme: In dem Haus ist eine Hexe. Die Hexe hat mir das Gesicht zerkratzt.,negative,no,negative,no,negative,no,negative,no
7-BremerStadtmusikanten,S75,Und vor der Tür steht ein Mann. Der Mann hat ein Messer. Mit dem Messer hat mir der Mann ins Bein gestochen.,negative,no,negative,no,negative,no,negative,no
7-BremerStadtmusikanten,S76,Und bei dem Misthaufen ist ein Monster. Das Monster hat mich getreten.,negative,no,negative,no,negative,no,negative,no
7-BremerStadtmusikanten,S77,Und auf dem Dach sitzt ein Polizist. Der Polizist wollte mich fangen. Deshalb bin ich fortgelaufen.,negative,no,negative,no,negative,no,negative,no
7-BremerStadtmusikanten,S78,Jetzt haben auch die anderen Räuber Angst. Die Räuber laufen fort.,positive,no,positive,yes,negative,no,negative,no
7-BremerStadtmusikanten,S79,Und die Räuber kommen nie mehr zu dem Haus zurück. Der Esel und der Hund und die Katze und der Hahn sind froh.,positive,no,positive,no,positive,no,positive,no
7-BremerStadtmusikanten,S80,Und die 4 Tiere bleiben in dem Haus. Die 4 Tiere fühlen sich sehr wohl in dem Haus. Deshalb wollen die 4 Tiere auch nicht mehr nach Bremen gehen.,positive,no,positive,no,positive,no,positive,no
7-BremerStadtmusikanten,S81,Und auch keine Stadtmusikanten werden. Das war das Märchen von den Bremer Stadtmusikanten.,neutral,no,neutral,no,neutral,no,neutral,no
